{
  "id": "configIndex",
  "version": "1.0.0",
  "files": {
    "metadata": "./metadata.json",
    "contact": "./contact.json",
    "navigation": "./navigation.json",
    "features": "./features.json",
    "testimonials": "./testimonials.json",
    "team": "./team.json",
    "faqs": "./faqs.json",
    "seo": "./seo.json",
    "shop": "./shop.json"
  },
  "note": "Load these files individually in your app or API. Use the file paths above to serve endpoints like /api/metadata, /api/features, etc.",
  "updatedAt": "2026-08-11T20:16:39.594Z"
}